{
  "$schema": "http://json-schema.org/draft-07/schema#",
  "title": "Provider Runtime Matrix V8 Schema",
  "type": "object",
  "required": ["schema_version", "matrix_id", "generated_by_task", "providers", "timestamp_utc"],
  "properties": {
    "schema_version": { "type": "string", "pattern": "^provider-runtime-matrix-v8$" },
    "matrix_id": { "type": "string", "minLength": 1 },
    "generated_by_task": { "type": "string", "minLength": 1 },
    "providers": {
      "type": "array",
      "items": {
        "type": "object",
        "required": ["provider_kind", "contract_status", "runtime_status", "runtime_verified"],
        "properties": {
          "provider_kind": { "type": "string" },
          "contract_status": {
            "type": "string",
            "enum": ["CONTRACT_PASS", "NOT_IMPLEMENTED", "FAIL"]
          },
          "runtime_status": {
            "type": "string",
            "enum": ["RUNTIME_PASS", "CONTRACT_PASS", "BLOCKED_ENV", "FAIL", "NOT_IMPLEMENTED", "SKIPPED_TEST_ONLY"]
          },
          "runtime_environment_kind": { "type": "string" },
          "environment_required": { "type": "boolean" },
          "environment_available": { "type": "boolean" },
          "runtime_verified": { "type": "boolean" },
          "blocked_reason": { "type": "string" },
          "test_commands": { "type": "array" },
          "evidence_file": { "type": "string" },
          "last_verified_utc": { "type": "string" },
          "allowed_claim": { "type": "string" },
          "forbidden_claim": { "type": "string" }
        }
      }
    },
    "summary": { "type": "object" },
    "timestamp_utc": { "type": "string", "format": "date-time" }
  }
}
