{
  "schema_version": "provider-runtime-matrix-v8",
  "matrix_id": "matrix-001",
  "generated_by_task": "PMX-001",
  "providers": [
    {"provider_kind":"local_file","contract_status":"CONTRACT_PASS","runtime_status":"RUNTIME_PASS","runtime_environment_kind":"local_real_runtime","environment_required":true,"environment_available":true,"runtime_verified":true,"blocked_reason":"","test_commands":["kivo_local_playback_e2e_test","kivo_micro_soak_test"],"evidence_file":"artifacts/p2/evidence/local_file_runtime.json","last_verified_utc":"2026-06-26T06:36:00Z","allowed_claim":"P2 Local Runtime: RUNTIME_PASS","forbidden_claim":"All Providers Runtime Verified"},

    {"provider_kind":"webdav","contract_status":"CONTRACT_PASS","runtime_status":"BLOCKED_ENV","runtime_environment_kind":"not_applicable","environment_required":true,"environment_available":false,"runtime_verified":false,"blocked_reason":"no webdav server","test_commands":[],"evidence_file":"","last_verified_utc":"","allowed_claim":"","forbidden_claim":""},
    {"provider_kind":"alist","contract_status":"CONTRACT_PASS","runtime_status":"BLOCKED_ENV","runtime_environment_kind":"not_applicable","environment_required":true,"environment_available":false,"runtime_verified":false,"blocked_reason":"no alist server","test_commands":[],"evidence_file":"","last_verified_utc":"","allowed_claim":"","forbidden_claim":""},
    {"provider_kind":"emby","contract_status":"CONTRACT_PASS","runtime_status":"BLOCKED_ENV","runtime_environment_kind":"not_applicable","environment_required":true,"environment_available":false,"runtime_verified":false,"blocked_reason":"no emby server","test_commands":[],"evidence_file":"","last_verified_utc":"","allowed_claim":"","forbidden_claim":""},
    {"provider_kind":"plex","contract_status":"CONTRACT_PASS","runtime_status":"BLOCKED_ENV","runtime_environment_kind":"not_applicable","environment_required":true,"environment_available":false,"runtime_verified":false,"blocked_reason":"no plex server","test_commands":[],"evidence_file":"","last_verified_utc":"","allowed_claim":"","forbidden_claim":""},
    {"provider_kind":"jellyfin","contract_status":"CONTRACT_PASS","runtime_status":"BLOCKED_ENV","runtime_environment_kind":"not_applicable","environment_required":true,"environment_available":false,"runtime_verified":false,"blocked_reason":"no jellyfin server","test_commands":[],"evidence_file":"","last_verified_utc":"","allowed_claim":"","forbidden_claim":""},

    {"provider_kind":"smb","contract_status":"NOT_IMPLEMENTED","runtime_status":"NOT_IMPLEMENTED","runtime_environment_kind":"not_applicable","environment_required":true,"environment_available":false,"runtime_verified":false,"blocked_reason":"","test_commands":[],"evidence_file":"","last_verified_utc":"","allowed_claim":"","forbidden_claim":""},
    {"provider_kind":"nfs","contract_status":"NOT_IMPLEMENTED","runtime_status":"NOT_IMPLEMENTED","runtime_environment_kind":"not_applicable","environment_required":true,"environment_available":false,"runtime_verified":false,"blocked_reason":"","test_commands":[],"evidence_file":"","last_verified_utc":"","allowed_claim":"","forbidden_claim":""},
    {"provider_kind":"ftp","contract_status":"NOT_IMPLEMENTED","runtime_status":"NOT_IMPLEMENTED","runtime_environment_kind":"not_applicable","environment_required":true,"environment_available":false,"runtime_verified":false,"blocked_reason":"","test_commands":[],"evidence_file":"","last_verified_utc":"","allowed_claim":"","forbidden_claim":""},
    {"provider_kind":"ftps","contract_status":"NOT_IMPLEMENTED","runtime_status":"NOT_IMPLEMENTED","runtime_environment_kind":"not_applicable","environment_required":true,"environment_available":false,"runtime_verified":false,"blocked_reason":"","test_commands":[],"evidence_file":"","last_verified_utc":"","allowed_claim":"","forbidden_claim":""},
    {"provider_kind":"sftp","contract_status":"NOT_IMPLEMENTED","runtime_status":"NOT_IMPLEMENTED","runtime_environment_kind":"not_applicable","environment_required":true,"environment_available":false,"runtime_verified":false,"blocked_reason":"","test_commands":[],"evidence_file":"","last_verified_utc":"","allowed_claim":"","forbidden_claim":""},
    {"provider_kind":"http_file","contract_status":"NOT_IMPLEMENTED","runtime_status":"NOT_IMPLEMENTED","runtime_environment_kind":"not_applicable","environment_required":true,"environment_available":false,"runtime_verified":false,"blocked_reason":"","test_commands":[],"evidence_file":"","last_verified_utc":"","allowed_claim":"","forbidden_claim":""},
    {"provider_kind":"https_file","contract_status":"NOT_IMPLEMENTED","runtime_status":"NOT_IMPLEMENTED","runtime_environment_kind":"not_applicable","environment_required":true,"environment_available":false,"runtime_verified":false,"blocked_reason":"","test_commands":[],"evidence_file":"","last_verified_utc":"","allowed_claim":"","forbidden_claim":""},
    {"provider_kind":"dlna_upnp","contract_status":"NOT_IMPLEMENTED","runtime_status":"NOT_IMPLEMENTED","runtime_environment_kind":"not_applicable","environment_required":true,"environment_available":false,"runtime_verified":false,"blocked_reason":"","test_commands":[],"evidence_file":"","last_verified_utc":"","allowed_claim":"","forbidden_claim":""},
    {"provider_kind":"s3_object","contract_status":"NOT_IMPLEMENTED","runtime_status":"NOT_IMPLEMENTED","runtime_environment_kind":"not_applicable","environment_required":true,"environment_available":false,"runtime_verified":false,"blocked_reason":"","test_commands":[],"evidence_file":"","last_verified_utc":"","allowed_claim":"","forbidden_claim":""},
    {"provider_kind":"minio_object","contract_status":"NOT_IMPLEMENTED","runtime_status":"NOT_IMPLEMENTED","runtime_environment_kind":"not_applicable","environment_required":true,"environment_available":false,"runtime_verified":false,"blocked_reason":"","test_commands":[],"evidence_file":"","last_verified_utc":"","allowed_claim":"","forbidden_claim":""},
    {"provider_kind":"google_drive","contract_status":"NOT_IMPLEMENTED","runtime_status":"NOT_IMPLEMENTED","runtime_environment_kind":"not_applicable","environment_required":true,"environment_available":false,"runtime_verified":false,"blocked_reason":"","test_commands":[],"evidence_file":"","last_verified_utc":"","allowed_claim":"","forbidden_claim":""},
    {"provider_kind":"onedrive","contract_status":"NOT_IMPLEMENTED","runtime_status":"NOT_IMPLEMENTED","runtime_environment_kind":"not_applicable","environment_required":true,"environment_available":false,"runtime_verified":false,"blocked_reason":"","test_commands":[],"evidence_file":"","last_verified_utc":"","allowed_claim":"","forbidden_claim":""},
    {"provider_kind":"iptv_hls","contract_status":"NOT_IMPLEMENTED","runtime_status":"NOT_IMPLEMENTED","runtime_environment_kind":"not_applicable","environment_required":true,"environment_available":false,"runtime_verified":false,"blocked_reason":"","test_commands":[],"evidence_file":"","last_verified_utc":"","allowed_claim":"","forbidden_claim":""},
    {"provider_kind":"airplay_cast","contract_status":"NOT_IMPLEMENTED","runtime_status":"NOT_IMPLEMENTED","runtime_environment_kind":"not_applicable","environment_required":true,"environment_available":false,"runtime_verified":false,"blocked_reason":"","test_commands":[],"evidence_file":"","last_verified_utc":"","allowed_claim":"","forbidden_claim":""},
    {"provider_kind":"trakt_api","contract_status":"NOT_IMPLEMENTED","runtime_status":"NOT_IMPLEMENTED","runtime_environment_kind":"not_applicable","environment_required":true,"environment_available":false,"runtime_verified":false,"blocked_reason":"","test_commands":[],"evidence_file":"","last_verified_utc":"","allowed_claim":"","forbidden_claim":""}
  ],
  "summary": {"total":21,"runtime_pass":1,"contract_pass":5,"not_implemented":15},
  "timestamp_utc": "2026-06-26T06:36:00Z"
}
